dataset_id,source,disease,sample_size,cell_number,platform,available_data_type,key_labels,recommended_use,limitation,download_status
GSE72056,GEO https://www.ncbi.nlm.nih.gov/geo/query/acc.cgi?acc=GSE72056; GEO FTP https://ftp.ncbi.nlm.nih.gov/geo/series/GSE72nnn/GSE72056/suppl/GSE72056_melanoma_single_cell_revised_v2.txt.gz,metastatic melanoma,19 patients/tumors reported,4645 single cells reported,Smart-seq2 / Illumina high-throughput sequencing,"processed expression matrix, GSE72056_melanoma_single_cell_revised_v2.txt.gz, 75031245 bytes by HEAD check","matrix header contains tumor; malignant(1=no,2=yes,0=unresolved); non-malignant cell type (T/B/Macrophage/Endothelial/CAF/NK codes); patient/tumor IDs are encoded in cell names",primary discovery scRNA-seq dataset for malignant versus non-malignant state definition and malignant cell-state reversal candidate discovery,no confirmed treatment-response label; processed normalized expression rather than raw count matrix in the checked file; gene-symbol-to-Ensembl mapping needed for Geneformer,not downloaded; URL and first matrix rows checked by ranged read only
GSE115978,GEO https://www.ncbi.nlm.nih.gov/geo/query/acc.cgi?acc=GSE115978; GEO FTP https://ftp.ncbi.nlm.nih.gov/geo/series/GSE115nnn/GSE115978/suppl/,melanoma immune checkpoint inhibitor context,"31 melanoma tumors reported; 32 sample IDs parsed from downloaded annotation, needs manual confirmation",7186 rows/cells parsed from GSE115978_cell.annotations.csv.gz,Smart-seq2 / GPL18573,cell annotations downloaded; counts.csv.gz 51508919 bytes by HEAD check; TPM and count matrices available from GEO supplementary files,"downloaded annotation columns: cells, samples, cell.types, treatment.group, Cohort, no.of.genes, no.of.reads; cell.types include Mal/T.CD8/T.CD4/T.cell/B.cell/Macrophage/CAF/Endo./NK/?; treatment.group includes treatment.naive and post.treatment",external scRNA-seq validation dataset; secondary ICI-context malignant/immune ecosystem validation; better count-matrix candidate for Geneformer tokenization than TPM-only datasets,explicit responder/non-responder clinical outcome was not present in downloaded cell.annotations and needs manual confirmation from paper/supplement; sample count differs depending on tumor versus parsed sample ID definition,metadata downloaded to data_raw/metadata/GSE115978_cell.annotations.csv.gz; expression matrices not downloaded
GSE120575,GEO https://www.ncbi.nlm.nih.gov/geo/query/acc.cgi?acc=GSE120575; GEO FTP https://ftp.ncbi.nlm.nih.gov/geo/series/GSE120nnn/GSE120575/suppl/,metastatic melanoma treated with immune checkpoint inhibitors,48 tumor biopsies from 32 patients reported; 48 patient/timepoint states parsed,16291 single immune cells confirmed after excluding protocol template rows,Smart-seq2; CD45+ sorted immune cells,"patient_ID metadata downloaded; TPM matrix available as GSE120575_Sade_Feldman_melanoma_single_cells_TPM_GEO.txt.gz, 126721504 bytes by HEAD check","metadata includes patient ID/timepoint, response, therapy; response labels Responder/Non-responder; therapy labels anti-CTLA4, anti-PD1, anti-CTLA4+PD1",immunotherapy-response-related validation dataset for immune-state and response association; useful for checking whether candidate malignant reversal regulators relate to response-associated microenvironment,not a malignant-cell discovery dataset because cells are CD45+ immune cells; TPM matrix only in checked GEO processed file; cell-type cluster annotation beyond patient/response may require paper/supplement or re-clustering,metadata downloaded to data_raw/metadata/GSE120575_patient_ID_single_cells.txt.gz; TPM matrix not downloaded
TCGA-SKCM,GDC project https://portal.gdc.cancer.gov/projects/TCGA-SKCM; GDC API https://api.gdc.cancer.gov/projects/TCGA-SKCM,skin cutaneous melanoma / nevi and melanomas,470 cases from GDC cases API,"not applicable, bulk cohort",bulk RNA-seq,GDC STAR - Counts gene expression quantification; 473 Gene Expression Quantification files by GDC API; clinical data available in GDC,"case submitter ID, primary/metastatic sample type, survival/stage/clinical variables; treatment response is not systematically available in standard TCGA clinical fields","TCGA-SKCM validation dataset for bulk expression, survival, stage, immune/malignancy deconvolution and candidate regulator prognostic association",bulk tissue lacks single-cell annotations; treatment-response validation is limited; tumor purity and immune composition confounding must be modeled,not downloaded; GDC API checked
GDSC,CancerRxGene / Sanger GDSC https://www.cancerrxgene.org/downloads; Sanger tool page https://www.sanger.ac.uk/tool/gdsc-genomics-drug-sensitivity-cancer/,pan-cancer cell lines including melanoma subset,melanoma-specific cell-line count needs manual confirmation for selected release,"not applicable, cell-line resource",cell-line drug sensitivity and omics,"drug sensitivity metrics, cell-line annotations, expression/mutation/CNV resources depending on release","cell line ID, tissue/cancer type, drug name, target/pathway, IC50/AUC or related sensitivity measures",GDSC validation resource for therapeutic vulnerability and candidate regulator-drug sensitivity association,cell lines are not patient tumors; release-specific melanoma subset must be filtered and recorded; no single-cell labels,not downloaded; source identified
DepMap/CCLE,DepMap portal https://depmap.org/portal/download/; DepMap downloads current release pages,pan-cancer cell lines including melanoma lineage,melanoma lineage model count needs manual confirmation for selected release,"not applicable, cell-line resource","CRISPR/RNAi dependency, expression, mutation, copy number, drug/compound response depending on release","gene effect/dependency, expression, mutation/CNV, lineage/model metadata, PRISM/compound sensitivity where available","model ID, lineage, gene dependency score, expression, mutation/CNV, compound response",DepMap validation resource for genetic dependency and therapeutic vulnerability of candidate regulators,cell-line models; release/version drift; perturbation dependency is not equivalent to malignant-state reversal in patient tumors,not downloaded; source identified
ChEMBL,ChEMBL https://www.ebi.ac.uk/chembl/; ChEMBL web services https://www.ebi.ac.uk/chembl/api/data/docs,drug-target and bioactivity database,not applicable,not applicable,curated bioactivity assays and drug-target annotations,"bioactivity, assay, molecule, target, mechanism, indication resources","target ID/gene, compound, standard_type, standard_value, assay organism/cell line, mechanism/indication where available","ChEMBL validation resource for druggability, known inhibitors/agonists, and assay evidence for candidate regulators",not melanoma-specific unless filtered by assay/cell line/indication; bioactivity evidence needs curation and target mapping,not downloaded; source identified
Open Targets,Open Targets Platform https://platform.opentargets.org/; data downloads https://platform.opentargets.org/downloads,target-disease associations including melanoma terms,not applicable,not applicable,"integrated genetic, literature, pathway, drug, tractability and safety evidence","target-disease association scores and evidence, tractability, safety, known drugs","EFO disease ID, target gene, association score/evidence type, tractability, safety, known drug links",Open Targets validation resource for target prioritization and disease relevance of candidate regulators,association scores are not causal proof; melanoma term/EFO mapping must be fixed before analysis; no expression matrix,not downloaded; source identified
